{
  "plan_schema_version": 1,
  "plan_id": "5d2e8a07-91b4-4c3f-8e6a-b7f04c2d1a93",
  "generated_at": "2026-10-23T14:07:30Z",
  "device_id": 57,
  "status": "approved",
  "pack": { "name": "openconfig-interfaces", "version": "1.0.0" },
  "targets": [
    {
      "protocol": "snmp",
      "endpoint": { "credential_ref": "snmp/edge-rtr-07" },
      "subscription": {
        "mode": "poll",
        "interval_seconds": 300,
        "oids": [
          "1.3.6.1.2.1.31.1.1.1.6",
          "1.3.6.1.2.1.31.1.1.1.10",
          "1.3.6.1.2.1.2.2.1.14",
          "1.3.6.1.2.1.2.2.1.8"
        ]
      },
      "metrics": [
        { "id": "interface.in_octets", "type": "counter", "unit": "octets", "counter_bits": 64, "labels": ["name"], "source": "1.3.6.1.2.1.31.1.1.1.6" },
        { "id": "interface.out_octets", "type": "counter", "unit": "octets", "counter_bits": 64, "labels": ["name"], "source": "1.3.6.1.2.1.31.1.1.1.10" },
        { "id": "interface.in_errors", "type": "counter", "unit": "packets", "counter_bits": 32, "labels": ["name"], "source": "1.3.6.1.2.1.2.2.1.14" },
        { "id": "interface.oper_status", "type": "gauge", "unit": "state", "labels": ["name"], "source": "1.3.6.1.2.1.2.2.1.8" }
      ]
    }
  ],
  "dedup_key": "e3b0c44298fc1c149afbf4c8996fb92427ae41e4649b934ca495991b7852b855"
}
